{
  "patient_id": "SYN-00017",
  "referral_state": "indicators_present",
  "family_history_status": "taken",
  "summary": "The pipeline surfaced this record because multiple criteria fired, including developmental regression, a neurodevelopmental feature with findings in other systems, family history, and multi-system features. The chart contains observations across neurodevelopment, cardiac, skeletal, and other specialties. Family history was recorded and includes an affected first-degree relative.",
  "reasons": [
    {
      "criterion": "MULTI_SYSTEM",
      "tier": "sufficient",
      "statement": "Recorded features span more than one body system, including neurodevelopmental, cardiac, skeletal, and neurology observations in the chart.",
      "evidence_ids": [
        "OBS:OBS-0000010",
        "OBS:OBS-0000007",
        "OBS:OBS-0000006",
        "OBS:OBS-0000009",
        "OBS:OBS-0000008"
      ]
    },
    {
      "criterion": "REGRESSION",
      "tier": "sufficient",
      "statement": "Developmental regression is explicitly documented in the record.",
      "evidence_ids": [
        "OBS:OBS-0000010"
      ]
    },
    {
      "criterion": "FAMILY_HISTORY",
      "tier": "contributory",
      "statement": "Family history was recorded and notes an affected first-degree relative.",
      "evidence_ids": [
        "FHX:SYN-00017"
      ]
    },
    {
      "criterion": "NEURODEV_PLUS",
      "tier": "contributory",
      "statement": "A neurodevelopmental feature is present alongside findings in other systems, including cardiac and skeletal observations.",
      "evidence_ids": [
        "OBS:OBS-0000008",
        "OBS:OBS-0000007",
        "OBS:OBS-0000006"
      ]
    }
  ],
  "limitations": [
    "This brief reflects only what was recorded in the chart; features that were never documented cannot be seen by the pipeline.",
    "The record provides selected observations and encounters, so this is not a complete picture of the child.",
    "Family history was recorded, but the rest of the chart may still be incomplete or sparse in places."
  ],
  "recommended_action": "clinician_review"
}